{"claim_id":"c-cbt-s5-thinking-depression-1963","evidence_level":"fulltext_direct","id":"ev-cbt-s5-thinking-depression-1963","locator":"Institutional bibliography, p. 2, 1963 entries, read 2026-07-27","provenance":"source_derived","publishable":true,"record_type":"evidence","short_quote":"Thinking and depression: Idiosyncratic content and cognitive distortions","source_id":"beck-institute-publications-2021","status":"verified","summary":"The institutional bibliography supplies title, year, journal, volume, and pages."}
