{
  "claim_id": "c-structuralism-s5-wundt-outlines-judd-1897",
  "evidence_level": "fulltext_direct",
  "id": "ev-structuralism-s5-wundt-outlines-judd-1897",
  "locator": "York Classics work header and English edition title identity",
  "provenance": "source_derived",
  "publishable": true,
  "record_type": "evidence",
  "short_quote": "Translated by Charles Hubbard Judd (1897)",
  "source_id": "wundt-1897-outlines-psychology",
  "status": "verified",
  "summary": "The English work header identifies Judd as translator and 1897 as the translation year."
}
