{"claim_id":"c-cbt-s7-third-wave-continuity","evidence_level":"fulltext_direct","id":"ev-cbt-s7-third-wave-continuity","locator":"Synthesizing previous generations, p. 660, read 2026-07-27","provenance":"source_derived","publishable":true,"record_type":"evidence","short_quote":"The third-wave interventions are not a rejection of the first and second waves of behavioral and cognitive therapy","source_id":"hayes-2004-third-wave","status":"verified","summary":"Hayes explicitly describes continuity rather than wholesale rejection."}
