{
  "claim_id": "c-structuralism-s1-definition",
  "evidence_level": "fulltext_direct",
  "id": "ev-structuralism-s1-definition-apa",
  "locator": "APA Dictionary of Psychology, structuralism, sense 1 (updated 2018-04-19)",
  "provenance": "source_derived",
  "publishable": true,
  "record_type": "evidence",
  "short_quote": "structuralism defined psychology as the study of mental experience and sought to investigate the structure of such experience",
  "source_id": "apa-dictionary-structuralism",
  "status": "verified",
  "summary": "APA's psychology-specific sense defines the movement by its object of study: mental experience and the structure of that experience."
}
