{
  "claim_id": "c-structuralism-s4-titchener-two-element-classes",
  "evidence_level": "fulltext_direct",
  "id": "ev-structuralism-s4-titchener-two-element-classes",
  "locator": "The Postulates of a Structural Psychology, p. 459",
  "provenance": "source_derived",
  "publishable": true,
  "record_type": "evidence",
  "short_quote": "the ultimate processes are two, and two only, sensations and affections",
  "source_id": "titchener-1898-postulates-structural-psychology",
  "status": "verified",
  "summary": "Titchener gives his two-class structural taxonomy immediately before distinguishing their attributes."
}
