{"claim_id":"c-cbt-s6-trial-quality-limitation","evidence_level":"fulltext_direct","id":"ev-cbt-s6-trial-quality-limitation","locator":"Results, Quality assessment, read 2026-07-27","provenance":"source_derived","publishable":true,"record_type":"evidence","short_quote":"Only 25 trials (17.4%) met all four quality criteria","source_id":"cuijpers-etal-2016-cbt-meta-update","status":"verified","summary":"The authors report the number meeting all quality criteria."}
