{
  "claim_id": "c-psychoanalysis-s1-contemporary-dual-scope",
  "evidence_level": "fulltext_direct",
  "id": "ev-psychoanalysis-s1-contemporary-dual-scope",
  "locator": "What is Psychoanalysis?, opening paragraph, read 2026-07-27",
  "provenance": "source_derived",
  "publishable": true,
  "record_type": "evidence",
  "short_quote": "both a clinical treatment method and an experiential study of the mind",
  "source_id": "ipa-what-is-psychoanalysis",
  "status": "verified",
  "summary": "The IPA's current overview describes psychoanalysis in both clinical and mind-investigation terms."
}
