{"claim_id":"c-indigenous-psychology-s6-aiatsis-four-principles","evidence_level":"fulltext_direct","id":"ev-indigenous-psychology-s6-aiatsis-four-principles","locator":"Research ethics framework, p. 9, read 2026-07-27","provenance":"source_derived","publishable":true,"record_type":"evidence","short_quote":"Indigenous self-determination Indigenous leadership Impact and value Sustainability and accountability","source_id":"aiatsis-2022-code-ethics","status":"verified","summary":"The framework lists its four principles together."}
