{
  "claim_id": "c-psychoanalysis-s4-unconscious-system",
  "evidence_level": "fulltext_direct",
  "id": "ev-psychoanalysis-s4-unconscious-system",
  "locator": "A Note on the Unconscious in Psycho-Analysis (1912), third sense, Proceedings XXVI p. 318",
  "provenance": "source_derived",
  "publishable": true,
  "record_type": "evidence",
  "short_quote": "The system revealed by the sign that the single acts forming parts of it are unconscious",
  "source_id": "freud-1912-note-unconscious",
  "status": "verified",
  "summary": "The passage moves from an attribute of individual acts to a named system of psychical activity."
}
