{
  "claim_id": "c-structuralism-s5-wundt-principles-original-1874",
  "evidence_level": "fulltext_direct",
  "id": "ev-structuralism-s5-wundt-principles-original-1874",
  "locator": "Digitized first edition, title page; Wellcome item date and publication identity",
  "provenance": "source_derived",
  "publishable": true,
  "record_type": "evidence",
  "short_quote": "Leipzig, Verlag von Wilhelm Engelmann. 1874.",
  "source_id": "wundt-1874-grundzuge-physiological-psychology",
  "status": "verified",
  "summary": "The digitized title identity and library metadata establish the 1874 Leipzig first edition."
}
