{"claim_id":"c-cbt-s1-protocol-plurality","evidence_level":"fulltext_direct","id":"ev-cbt-s1-protocol-plurality","locator":"What happens in CBT, lines 85-87, read 2026-07-27","provenance":"source_derived","publishable":true,"record_type":"evidence","short_quote":"The type you have will depend on why you're having it and your symptoms.","source_id":"nhs-cbt-overview","status":"verified","summary":"The overview explicitly makes CBT form contingent on reason and symptoms."}
