{"claim_id":"c-cbt-s6-four-disorder-scope","evidence_level":"fulltext_direct","id":"ev-cbt-s6-four-disorder-scope","locator":"Results, selection and inclusion of trials, read 2026-07-27","provenance":"source_derived","publishable":true,"record_type":"evidence","short_quote":"A total of 144 trials met inclusion criteria","source_id":"cuijpers-etal-2016-cbt-meta-update","status":"verified","summary":"The results section reports the total and its four diagnostic strata."}
