{"claim_id":"c-cbt-s7-second-wave-description","evidence_level":"fulltext_direct","id":"ev-cbt-s7-second-wave-description","locator":"Abstract, p. 639, read 2026-07-27","provenance":"source_derived","publishable":true,"record_type":"evidence","short_quote":"guided by social learning and cognitive principles","source_id":"hayes-2004-third-wave","status":"verified","summary":"Hayes's abstract distinguishes the second wave by its principles and targets."}
