{
  "claim_id": "c-psychoanalysis-s5-ego-id-1923",
  "evidence_level": "fulltext_direct",
  "id": "ev-psychoanalysis-s5-ego-id-1923",
  "locator": "Freud Edition Das Ich und das Es work inventory, Historical Manifestations",
  "provenance": "source_derived",
  "publishable": true,
  "record_type": "evidence",
  "short_quote": "1923-003/1923 Das Ich und das Es — Erstveröffentlichung",
  "source_id": "freud-edition-ego-id-versions",
  "status": "verified",
  "summary": "The work inventory labels the 1923 German manifestation as the first publication."
}
