{"claim_id":"c-cbt-s1-delivery-formats","evidence_level":"fulltext_direct","id":"ev-cbt-s1-delivery-formats","locator":"What happens in CBT, lines 89-95, read 2026-07-27","provenance":"source_derived","publishable":true,"record_type":"evidence","short_quote":"You can have CBT in different ways","source_id":"nhs-cbt-overview","status":"verified","summary":"The NHS states delivery plurality before listing guided self-help, individual, and group arrangements."}
