{
  "claim_id": "c-structuralism-s2-leahey-historiography",
  "evidence_level": "abstract_only",
  "id": "ev-structuralism-s2-leahey-historiography",
  "locator": "Publisher-hosted abstract, sentences 1-4",
  "provenance": "source_derived",
  "publishable": false,
  "record_type": "evidence",
  "source_id": "leahey-1981-mistaken-mirror",
  "status": "retrieved",
  "summary": "The abstract says the faithful-copy belief is false and states that Titchener rejected many of Wundt's goals and concepts."
}
