{
  "id": "ev-dk-critique",
  "record_type": "evidence",
  "claim_id": "c-dk-critique",
  "source_id": "gignac-zajenkowski-2020",
  "locator": "Intelligence, volume 80",
  "evidence_level": "metadata_only",
  "summary": "Metadata-level record of a documented statistical-artefact critique.",
  "status": "retrieved",
  "publishable": false,
  "provenance": "source_derived"
}
