{
  "claim_id": "c-structuralism-s5-titchener-outline-1896",
  "evidence_level": "fulltext_direct",
  "id": "ev-structuralism-s5-titchener-outline-1896",
  "locator": "Library of Congress digitized item, title and Created / Published fields",
  "provenance": "source_derived",
  "publishable": true,
  "record_type": "evidence",
  "short_quote": "New York, The Macmillan Company; London, Macmillan & Co., ltd., 1896",
  "source_id": "titchener-1896-outline-psychology",
  "status": "verified",
  "summary": "The Library of Congress digital item supplies the title, author, publishers and 1896 date."
}
