{"claim_id":"c-cbt-s6-mdd-pooled-effect","evidence_level":"fulltext_direct","id":"ev-cbt-s6-mdd-pooled-effect","locator":"Results, Effects of CBT on MDD, read 2026-07-27","provenance":"source_derived","publishable":true,"record_type":"evidence","short_quote":"g=0.75 (95% CI: 0.64-0.87), with high heterogeneity","source_id":"cuijpers-etal-2016-cbt-meta-update","status":"verified","summary":"The MDD results give the pooled effect, interval, and heterogeneity."}
