{
  "claim_id": "c-structuralism-s1-scope-boundary",
  "evidence_level": "fulltext_indirect",
  "id": "ev-structuralism-s1-scope-boundary-apa",
  "locator": "APA Dictionary of Psychology, structuralism, contrast between numbered senses 1 and 2",
  "provenance": "source_derived",
  "publishable": true,
  "record_type": "evidence",
  "short_quote": "a movement in various disciplines that study human behavior and culture",
  "source_id": "apa-dictionary-structuralism",
  "status": "verified",
  "summary": "The entry assigns the psychology school and the later cross-disciplinary movement to separate numbered senses, supporting an explicit entity boundary."
}
